{
  "schemaVersion": "1.0.0",
  "messageId": "brmsg_000000000000000000000018",
  "type": "bridge.operation.response",
  "operation": "listApps",
  "status": "ok",
  "error": null,
  "payload": {
    "apps": [
      {
        "bundleId": "com.apple.Safari",
        "name": "Safari",
        "iconPng": "iVBORw0KGgoAAAANSUhEUgAAAAEAAAABCAYAAAAfFcSJAAAADUlEQVR42mNkYPhfDwAChwGA60e6kgAAAABJRU5ErkJggg=="
      },
      {
        "bundleId": "com.anthropic.claudefordesktop",
        "name": "Claude"
      }
    ],
    "truncated": false
  }
}
