{
  "schemaVersion": "1.0.0",
  "messageId": "brmsg_000000000000000000000020",
  "type": "bridge.operation.response",
  "operation": "updateQuickApps",
  "status": "ok",
  "error": null,
  "payload": {
    "accepted": true,
    "quickApps": ["vscode", "terminal", "claude-desktop"],
    "errors": []
  }
}
