{
  "schemaVersion": "1.0.0",
  "messageId": "brmsg_000000000000000000000024",
  "type": "bridge.operation.response",
  "operation": "listUrls",
  "status": "ok",
  "error": null,
  "payload": {
    "urls": [
      {
        "id": "github",
        "label": "GitHub",
        "target": "https://github.com",
        "iconPng": "iVBORw0KGgoAAAANSUhEUgAAAAEAAAABCAQAAAC1HAwCAAAAC0lEQVR42mP8z8BQDwAEhQGAhKmMIQAAAABJRU5ErkJggg=="
      },
      { "id": "docs", "label": "Project Docs", "target": "https://docs.cerebralhelm.local" },
      { "id": "work-mail", "label": "Work Mail", "target": "https://mail.google.com", "profile": "Profile 1" }
    ]
  }
}
