{
  "schemaVersion": "1.0.0",
  "messageId": "brmsg_000000000000000000000064",
  "type": "bridge.operation.response",
  "operation": "resetCanvas",
  "status": "ok",
  "error": null,
  "payload": {
    "available": true,
    "endpoint": "http://127.0.0.1:8899/canvas/ingest",
    "token": "cm90YXRlZC10b2tlbi1wbGFjZWhvbGRlci12YWx1ZQ",
    "lastScrapedAt": null,
    "courseCount": 0,
    "deadlineCount": 0
  }
}
